id;user_id;ft_link;titel;jaar;regisseur;cast;genre;land;cover;tagline;duur;synopsis;ft_rating;ft_votes;imdb_id;imdb_rating;imdb_votes;starttijd;eindtijd;zender;filmtip;date
1;2;https://www.filmtotaal.nl/film/25795;Maya de Bij - Eerste Vlucht;2014;Alexs Stadermann;Kodi Smit-McPhee:Noah Taylor:Richard Roxburgh:Jacki Weaver:Miriam Margolyes:Andy McPhee;Animatie:Avontuur:Komedie:Familiefilm;"Australi&euml;:Duitsland";https://www.filmtotaal.nl/images/covers/b9sudhmgdx.jpg;;89;Maya is een kleine nieuwsgierige bij die niet in de bijenkorf wil blijven, maar de mooie weide en haar bewoners wil ontdekken. Als de koninginnenbrij gestolen wordt, zijn de horzels als aartsvijanden van de bijen meteen verdacht. Willy en Maya besluiten samen het mysterie van de verdwenen koninginnenbrij op te lossen. Na een lange en spannende reis naar de korf van de horzels vinden Maya en Willy de ware schuldige. De kleine Maya en haar vriendjes redden de bijenkorf van de gemene, hebzuchtige adviseur van de Koningin, Buzzlinda, en zorgen ervoor dat de langdurige vijandigheid tussen bijen en horzels voorgoed tot het verleden behoort.;0;0;3336368;6;1210;2018-10-25 12:00:00;2018-10-25 13:25:00;NPO3;1;25-10-2018
2;2;https://www.filmtotaal.nl/film/23628;Standing Ovation;2010;Stewart Raffill;Devon Jordan:Ashley Cutrona:Erika Corvette:London Clark:Jeana Zettler:Brooke Feldman;Musical;Verenigde Staten;https://www.filmtotaal.nl/images/covers/nbp4p416p1.jpg;Dance - Sing - Dream;105;"Vijf jonge meiden vormen een zanggroep genaamd The 5 Ovations en doen mee aan een nationale wedstrijd waarmee ze een miljoen dollar in contanten mee kunnen verdienen. Met slechts een beperkt budget en weinig bronnen, gebruiken de kinderen hun eigen slimheid, moed en passie om spectaculaire liedjes en dansnummers te cre&euml;ren. Hun rivalen zijn The Wiggies: vijf rijke, getalenteerde, maar ook gewetenloze zusjes die samen met hun ouders zich alles veroorloven om maar te kunnen winnen.";0;0;1303803;3.4;556;2018-10-25 15:30:00;2018-10-25 15:31:00;NPO3;0;25-10-2018
3;2;https://www.filmtotaal.nl/film/29926;Full Out;2015;Sean Cisterna;Jennifer Beals:Ana Golja:Sarah Fisher:Jake Epstein:Trevor Tordjman:Robbie Graham-Kuntz;Biografie:Drama:Familiefilm:Sport;Canada:Verenigde Staten;https://www.filmtotaal.nl/images/covers/yyxab1owl5.jpg;;90;"Ariana Berlin, een tiener die turnster en hiphop danser is, raakt ernstig gewond bij een auto-ongeluk. Haar carri&egrave;re lijkt voorbij, maar dan ontmoet ze coach Val, die haar helpt bij het herstel en het najagen van haar olympische droom.";0;0;3977462;6.8;441;2018-10-25 15:31:00;2018-10-25 17:00:00;NPO3;1;25-10-2018
4;4;https://www.filmtotaal.nl/film/18515;This Means War;2012;McG;Reese Witherspoon:Chris Pine:Tom Hardy:Til Schweiger:Chelsea Handler:John Paul Ruttan;Actie:Komedie:Romantiek;Verenigde Staten;https://www.filmtotaal.nl/images/covers/q8slf957bk.jpg;It's SPY against SPY.;98;Twee CIA-agenten gaan de strijd met elkaar aan als ze ontdekken dat ze met dezelfde vrouw aan het daten zijn.;5.9;34;1596350;6.3;146414;2018-10-25 20:30:00;2018-10-25 22:25:00;NET5;1;25-10-2018
5;5;https://www.filmtotaal.nl/film/23937;Knerten i knipe;2011;Arild Østin Ommundsen;"Adrian Gr&oslash;nnevik Smith:Petrus A. Christensen:Pernille S&oslash;rensen:Jan Gunnar R&oslash;ise:&Aring;sleik Engmark:Sampda Sharma";Familiefilm;Noorwegen;https://www.filmtotaal.nl/images/covers/r2t2orwhs6.jpg;;72;Knoester, een pratende tak en de beste vriend van Junior, is meeverhuisd en heeft zijn grote liefde Berkelientje meegenomen. Een paar maanden na de verhuizing maken de ouders van Junior zich zorgen: hun zoon heeft nog altijd geen nieuwe vriendjes gemaakt. Dat komt omdat Junior zich prima vermaakt met Knoester en de andere kinderen in de straat er alleen maar op uit lijken om hem te pesten. Maar dan is Knoester spoorloos verdwenen. Junior gaat op een zoektocht om Knoester te vinden.;0;0;1611876;6;93;2018-10-26 12:00:00;2018-10-26 13:10:00;NPO3;1;26-10-2018
6;5;https://www.filmtotaal.nl/film/14436;Anaconda III;2008;Don E. FauntLeRoy;David Hasselhoff:Crystal Allen:Ryan McCluskey:Patrick Regis:Anthony Green:John Rhys-Davies;Actie:Horror:Sci-Fi:Thriller;"Verenigde Staten:Roemeni&euml;";https://www.filmtotaal.nl/images/covers/0v44gnburc.jpg;They Can Taste Your Fear;91;Een biljonair besluit om veel geld te bieden aan een huurling om een grote en levensgevaarlijke slang te vangen, omdat deze slang belangrijk is voor de genezing van een terminale ziekte. Het vangen van deze grote slang is echter nog niet zo makkelijk als het in eerste instantie lijkt.;1.9;7;1137996;2.7;5536;2018-10-26 23:00:00;2018-10-27 01:05:00;Comedy Central;0;26-10-2018
7;5;https://www.filmtotaal.nl/film/19209;Black Swan;2010;Darren Aronofsky;Natalie Portman:Mila Kunis:Vincent Cassel:Barbara Hershey:Winona Ryder:Benjamin Millepied;Drama:Thriller;Verenigde Staten;https://www.filmtotaal.nl/images/covers/dd9v3lpumo.jpg;;108;"Balletdanseres Nina (Natalie Portman) maakt deel uit van een balletgezelschap waarbinnen hevige concurentie heerst. De belangrijkste danseres van dat moment, Beth (Winona Ryder), staat op het punt om te vertrekken en iedereen wil haar plaats innemen, te meer daar zij tot dan toe een hoofdrol vertolkte in het populaire Swan Lake ballet van Tsjaikovski. Volgens artistiek leider Yevna (Vincent Cassel) heeft ze zeker talent, maar mist ze het &eacute;&eacute;n en ander op het mentale vlak. Ook moet ze afrekenen met haar speelzieke rivale Lily (Mila Kunis) wil zij een kans maken om de hoofdrol te gaan vertolken.";7.9;140;0947798;8;612072;2018-10-27 01:05:00;2018-10-27 02:50:00;RTL8;1;26-10-2018
